base_station,0,0	Cave Straight 03 Type B,90,0	Cave Straight 01 Type B,90,0	Cave Corner 02 Type B,90,0
			Cave Vertical Shaft Type B,0,-4				Cave Corner 01 Type B,180,-6	Cave Straight 02 Type B,-90,-6,Rescue Randy@11.6 0.05 -0.02 0 0 -90	Cave Cap Type B,90,-6
			Cave Corner 02 Type B,-90,-4	Cave Straight 02 Type B,-90,-4	Cave Elevation Type B,-90,-6	Cave Straight 01 Type B,90,-6,Phone@0 0.64 0.39 -86.66 0 0	Cave 3 Way 01 Type B,90,-6
							Cave Corner 02 Type B,-90,-6	Cave Corner 02 Type B,90,-6
								Cave Vertical Shaft Type B,180,-6
								Cave Corner 02 Type B,-90,-2	Cave Cap Type B,90,-2
